{
  "id": "E020",
  "name": "Teacher value-added narrow topic",
  "prompt": "What are the 5 most important papers on teacher value-added?",
  "expected_output_language": "en",
  "domain_type": "thematic",
  "expected_n": 5,
  "constraints": {
    "pdf_download": "ask",
    "chinese_literature_question": false,
    "must_cover_branches": [
      "Teacher value-added model",
      "Peer effects in education",
      "Bias correction and identification",
      "Long-term effects of teacher value-added",
      "Policy applications and school accountability"
    ]
  },
  "notes_for_graders": "Very narrow thematic test. Should ask about PDF download. Output should stay tightly focused on teacher value-added and education production."
}
