{
  "id": "E002-P1",
  "name": "English development economics (paraphrase 1)",
  "prompt": "发展经济学最重要的 10 篇论文是哪些？",
  "expected_output_language": "zh",
  "domain_type": "predefined",
  "expected_n": 10,
  "constraints": {
    "pdf_download": "ask",
    "chinese_literature_question": false,
    "must_cover_branches": [
      "Growth and convergence",
      "Poverty and inequality measurement",
      "Human capital",
      "Agricultural and rural development",
      "Urbanization and structural transformation",
      "Institutions and governance",
      "Credit markets and microfinance",
      "Social networks and risk-sharing",
      "Conflict and development",
      "RCT and experimental methods"
    ]
  },
  "notes_for_graders": "Paraphrase variant of E002 in Chinese. Chinese summaries expected. Should ask about PDF download; no Chinese literature question."
}
