{
  "id": "E001",
  "name": "Chinese labor economics broad field",
  "prompt": "帮我找 10 篇劳动经济学最重要的论文，我需要快速了解这个领域的研究脉络。",
  "expected_output_language": "zh",
  "domain_type": "predefined",
  "expected_n": 10,
  "constraints": {
    "pdf_download": "ask",
    "chinese_literature_question": true,
    "must_cover_branches": [
      "Labor supply",
      "Human capital",
      "Wage determination and inequality",
      "Unemployment and search/matching",
      "Discrimination",
      "Immigration",
      "Labor market institutions",
      "Personnel economics",
      "Intergenerational mobility",
      "Local labor markets and spatial equilibrium"
    ]
  },
  "notes_for_graders": "Chinese summaries and justifications expected. Skill should proactively ask about Chinese literature and PDF download."
}